comb_num,var_comb_num,interview_question,question_type,question_answer
1,1,Describe a challenging project you worked on. What was your role and how did you handle it?,behavioral,"
In my last role as a project manager, I led a team on a high-stakes software 
development project. We faced a tight deadline and unexpected technical hurdles. 
I organized extra brainstorming sessions, delegated tasks based on individual 
strengths, and maintained open communication with stakeholders. We delivered the 
project on time, and it was well-received by the client.
"
2,1,Describe a challenging project you worked on. What was your role and how did you handle it?,behavioral,"
I was part of a marketing campaign that faced budget cuts. My role was to design 
the digital ads. I had to be creative with limited resources, so I focused on 
leveraging free online tools and optimizing our existing content. The campaign 
was successful, though it didn't reach all our targets.
"
3,1,Describe a challenging project you worked on. What was your role and how did you handle it?,behavioral,"
As a junior analyst, I worked on a data migration project that was complex. My 
role was to assist senior analysts. I ensured that I was thorough in my tasks 
and asked for feedback regularly. The project was successful, but I wish I had 
a more active role.
"
4,1,Describe a challenging project you worked on. What was your role and how did you handle it?,behavioral,"
I worked on a challenging project last year, but honestly, I didn't have much of 
a role. I just did what I was told and didn't really understand the bigger picture.
"
5,1,Describe a challenging project you worked on. What was your role and how did you handle it?,behavioral,"
In my previous job, there was a project that was really tough. I found it 
overwhelming, so I mostly kept to the tasks I was comfortable with and didn't 
venture much beyond that.
"
6,1,Describe a challenging project you worked on. What was your role and how did you handle it?,behavioral,"
I was involved in a project that didn't go well. Our team had many issues, and 
I think it was mostly due to poor management. I just tried to stay out of the 
way and do my part.
"
7,1,Describe a challenging project you worked on. What was your role and how did you handle it?,behavioral,"
I led a cross-functional team on a critical product launch that faced major 
hurdles due to supply chain disruptions. As the project manager, I quickly 
re-strategized, identifying alternative suppliers and adjusting our timelines 
while maintaining open communication with all stakeholders. My proactive approach 
and contingency planning enabled us to launch successfully, albeit with a slight 
delay, but with no compromise on quality.
"
8,1,Describe a challenging project you worked on. What was your role and how did you handle it?,behavioral,"
In my role as an IT specialist, I was tasked with leading a critical data migration 
project under a tight deadline. Recognizing the complexity, I implemented a 
phased approach, conducted thorough risk assessments, and held regular team meetings 
to ensure everyone was aligned and on track. My emphasis on meticulous planning 
and team coordination led to a successful migration with zero data loss and 
minimal downtime.
"
9,1,How do you handle disagreements with colleagues?,behavioral,"
I believe in open communication and empathy. In a previous job, a colleague and 
I disagreed on a sales strategy. I initiated a meeting to discuss our viewpoints. 
We combined our ideas and developed a hybrid strategy that proved effective.
"
10,1,How do you handle disagreements with colleagues?,behavioral,"
Disagreements can be challenging. I usually try to avoid confrontation and go 
with the majority's opinion to keep the peace.
"
11,1,How do you handle disagreements with colleagues?,behavioral,"
In my last role, I disagreed with a teammate over a design choice. We presented 
our ideas to the team, and I accepted the team's decision even though it wasn't 
my preference. I learned a lot from the process.
"
12,1,How do you handle disagreements with colleagues?,behavioral,"
I don't like conflicts, so I usually just keep my opinions to myself. It's easier 
to just agree with others even if I don't think it's the best idea.
"
13,1,How do you handle disagreements with colleagues?,behavioral,"
Disagreements are tough. In the past, I've had arguments with colleagues. I tend 
to stick to my point because I believe in my ideas strongly.
"
14,1,How do you handle disagreements with colleagues?,behavioral,"
I usually talk to other colleagues about the disagreement and try to get them on 
my side. I find it's better to have support when there's a conflict.
"
15,1,How do you handle disagreements with colleagues?,behavioral,"
I believe in addressing disagreements constructively. In one instance, a colleague 
and I had differing views on a marketing strategy. I initiated a meeting to discuss 
our perspectives in-depth. Through active listening and collaborative discussion, 
we combined the best elements of our ideas, resulting in a more robust strategy 
that increased our campaign's success by 30%.
"
16,1,How do you handle disagreements with colleagues?,behavioral,"
I approach disagreements with openness and a focus on problem-solving. Once, when 
a project proposal I was working on with a colleague led to a difference in opinion, 
we decided to seek input from other team members and conducted a small workshop. 
This approach not only resolved our disagreement but also brought in valuable new 
insights, leading to a stronger, team-endorsed proposal.
"
17,1,How do you stay motivated and manage your time effectively?,behavioral,"
I stay motivated by setting clear, achievable goals. For time management, I use 
the Pomodoro Technique, breaking my work into focused intervals with short breaks. 
This keeps me productive and prevents burnout.
"
18,1,How do you stay motivated and manage your time effectively?,behavioral,"
Motivation can be tough, especially with routine tasks. I try to keep a big-picture 
perspective and remind myself how my work contributes to the company's goals. As 
for time management, I prioritize tasks each morning and adjust as needed 
throughout the day.
"
19,1,How do you stay motivated and manage your time effectively?,behavioral,"
I find motivation in challenges and learning new things. I manage my time by 
setting weekly goals and reviewing my progress every Friday. This helps me stay 
on track and adjust my plans for the following week.
"
20,1,How do you stay motivated and manage your time effectively?,behavioral,"
I struggle with motivation, especially on long projects. I don't really have a 
time management strategy, I just do things as they come up.
"
21,1,How do you stay motivated and manage your time effectively?,behavioral,"
I find it hard to stay motivated. I often procrastinate and then have to rush to 
meet deadlines. It's stressful, but that's just how I've always worked.
"
22,1,How do you stay motivated and manage your time effectively?,behavioral,"
I tend to work in bursts. Sometimes I'm really motivated, other times not so 
much. I don't really plan my time; I just work more when the deadlines are near.
"
23,1,How do you stay motivated and manage your time effectively?,behavioral,"
My motivation comes from setting challenging yet achievable goals. I use a 
combination of the Eisenhower Matrix for prioritizing tasks and the Pomodoro 
Technique for focused work sessions. This approach helped me successfully manage 
multiple projects simultaneously, leading to a 20% increase in efficiency in my 
department.
"
24,1,How do you stay motivated and manage your time effectively?,behavioral,"
To stay motivated, I align my work with my personal and career growth goals. For 
time management, I meticulously plan my weeks every Sunday, setting clear 
objectives for each day, and review my progress nightly. This method was instrumental 
in my recent project, where I managed to deliver high-quality work two weeks ahead 
of schedule.
"